{
  "$schema": "https://json-schema.org/draft/2020-12/schema",
  "$id": "https://schemas.codex-video-edit.invalid/timeline.schema.json",
  "title": "Canonical non-destructive timeline",
  "type": "object",
  "additionalProperties": false,
  "required": [
    "schema_version",
    "timeline_id",
    "project_id",
    "revision_id",
    "duration_us",
    "frame_rate",
    "canvas",
    "tracks",
    "clips",
    "operation_ids",
    "zoom_ids",
    "speed_ids"
  ],
  "properties": {
    "schema_version": {
      "type": "string",
      "const": "1.0"
    },
    "timeline_id": {
      "type": "string",
      "pattern": "^[A-Za-z0-9][A-Za-z0-9._-]{1,127}$"
    },
    "project_id": {
      "type": "string",
      "pattern": "^[A-Za-z0-9][A-Za-z0-9._-]{1,127}$"
    },
    "revision_id": {
      "type": "string",
      "pattern": "^[A-Za-z0-9][A-Za-z0-9._-]{1,127}$"
    },
    "duration_us": {
      "type": "integer",
      "minimum": 0
    },
    "frame_rate": {
      "type": "object",
      "additionalProperties": false,
      "required": [
        "numerator",
        "denominator"
      ],
      "properties": {
        "numerator": {
          "type": "integer",
          "minimum": 1
        },
        "denominator": {
          "type": "integer",
          "minimum": 1
        }
      }
    },
    "canvas": {
      "type": "object",
      "additionalProperties": false,
      "required": [
        "width",
        "height",
        "aspect_ratio"
      ],
      "properties": {
        "width": {
          "type": "integer",
          "minimum": 1
        },
        "height": {
          "type": "integer",
          "minimum": 1
        },
        "aspect_ratio": {
          "enum": [
            "16:9",
            "9:16",
            "1:1",
            "4:5",
            "custom"
          ]
        }
      }
    },
    "tracks": {
      "type": "array",
      "items": {
        "type": "object",
        "additionalProperties": false,
        "required": [
          "track_id",
          "kind",
          "order",
          "visible",
          "locked"
        ],
        "properties": {
          "track_id": {
            "type": "string",
            "pattern": "^[A-Za-z0-9][A-Za-z0-9._-]{1,127}$"
          },
          "kind": {
            "enum": [
              "main_video",
              "camera",
              "audio",
              "broll",
              "text",
              "captions",
              "effects"
            ]
          },
          "order": {
            "type": "integer",
            "minimum": 0
          },
          "visible": {
            "type": "boolean"
          },
          "locked": {
            "type": "boolean"
          }
        }
      },
      "minItems": 1
    },
    "clips": {
      "type": "array",
      "minItems": 1,
      "maxItems": 4096,
      "items": {
        "type": "object",
        "additionalProperties": false,
        "required": [
          "clip_id",
          "track_id",
          "source_id",
          "source_start_us",
          "source_end_us",
          "timeline_start_us",
          "timeline_end_us",
          "enabled"
        ],
        "properties": {
          "clip_id": {
            "type": "string",
            "pattern": "^[A-Za-z0-9][A-Za-z0-9._-]{1,127}$"
          },
          "track_id": {
            "type": "string",
            "pattern": "^[A-Za-z0-9][A-Za-z0-9._-]{1,127}$"
          },
          "source_id": {
            "type": "string",
            "pattern": "^[A-Za-z0-9][A-Za-z0-9._-]{1,127}$"
          },
          "source_start_us": {
            "type": "integer",
            "minimum": 0
          },
          "source_end_us": {
            "type": "integer",
            "minimum": 0
          },
          "timeline_start_us": {
            "type": "integer",
            "minimum": 0
          },
          "timeline_end_us": {
            "type": "integer",
            "minimum": 0
          },
          "enabled": {
            "type": "boolean"
          },
          "transform": {
            "type": "object",
            "additionalProperties": false,
            "properties": {
              "x": {
                "type": "number"
              },
              "y": {
                "type": "number"
              },
              "scale": {
                "type": "number",
                "exclusiveMinimum": 0
              },
              "rotation_deg": {
                "type": "number"
              },
              "opacity": {
                "type": "number",
                "minimum": 0,
                "maximum": 1
              }
            }
          }
        }
      }
    },
    "operation_ids": {
      "type": "array",
      "items": {
        "type": "string",
        "pattern": "^[A-Za-z0-9][A-Za-z0-9._-]{1,127}$"
      }
    },
    "zoom_ids": {
      "type": "array",
      "items": {
        "type": "string",
        "pattern": "^[A-Za-z0-9][A-Za-z0-9._-]{1,127}$"
      }
    },
    "speed_ids": {
      "type": "array",
      "items": {
        "type": "string",
        "pattern": "^[A-Za-z0-9][A-Za-z0-9._-]{1,127}$"
      }
    },
    "caption_style_id": {
      "type": [
        "string",
        "null"
      ],
      "pattern": "^[A-Za-z0-9][A-Za-z0-9._-]{1,127}$"
    },
    "created_at": {
      "type": "string",
      "pattern": "^\\d{4}-\\d{2}-\\d{2}T\\d{2}:\\d{2}:\\d{2}(?:\\.\\d+)?Z$"
    }
  }
}
